text,category,intent,customer_tier,source_channel,sla_hours_remaining,ticket_age_hours,repeat_contact_count,urgency_keyword_score,exclamation_count,all_caps_ratio,customer_sentiment,business_impact,priority
I want assistance to see your allowed payment modalties,Billing & Payments,check_payment_methods,Free,zendesk,-19.2,91.2,0,0,0,0.0,Neutral,Minor,Low
i do not know how to open a standard account,Account & Authentication,create_account,Free,freshdesk,72.0,0.0,1,0,0,0.0,Neutral,Minor,Medium
assistance to ujnsubscribe to ur newsletter,Subscription & Account Management,newsletter_subscription,Free,email,38.7,33.3,0,0,0,0.0,Neutral,Minor,Medium
want help to switch several items of purchase,Orders & Shipping,change_order,Basic,salesforce,22.4,25.6,0,0,0,0.0,Neutral,Moderate,Medium
I'd like to see ur money back guarantee how to do it,Returns & Refunds,check_refund_policy,Free,website,4.0,68.0,0,0,0,0.0,Neutral,Minor,Medium
where can I list your available payment modalities?,Billing & Payments,check_payment_methods,Basic,website,48.0,0.0,1,0,0,0.0,Neutral,Minor,Low
i want assistance to see how soon can i expect the item,Orders & Shipping,delivery_period,Free,website,42.9,29.1,0,0,0,0.0,Neutral,Minor,Medium
"I don't have a account, help me opening one",Account & Authentication,create_account,Pro,freshdesk,-13.0,37.0,0,0,0,0.0,Neutral,Minor,Medium
help me contact customer assistance,General Inquiries,contact_customer_service,Pro,website,24.0,0.0,1,0,0,0.0,Neutral,Minor,Medium
register,Account & Authentication,create_account,Pro,zendesk,12.1,11.9,2,0,0,0.0,Neutral,Minor,Medium
I have problems with account removal,Account & Authentication,delete_account,Free,website,72.0,0.0,0,0,0,0.0,Frustrated,Moderate,Medium
i dont know how i could inform of a problem with a sign-up,Account & Authentication,registration_problems,Free,email,-53.7,125.7,0,0,0,0.0,Frustrated,Moderate,High
"I don't understand you, help talking to a goddamn person",General Inquiries,contact_human_agent,Basic,freshdesk,45.5,2.5,0,0,0,0.0,Frustrated,Moderate,Medium
could uhelp me to write a goddamn opinion about a product,Customer Feedback,review,Free,email,67.4,4.6,0,0,0,0.0,Frustrated,Minor,Medium
I am trying to talk with customer support,General Inquiries,contact_customer_service,Pro,freshdesk,4.2,19.8,0,0,0,0.0,Neutral,Minor,Medium
i expect a compensation of was it processed,Returns & Refunds,track_refund,Pro,salesforce,3.8,20.2,1,0,0,0.0,Frustrated,Moderate,Medium
I do not know what to do to see the cancellation charges,Returns & Refunds,check_cancellation_fee,Pro,salesforce,20.5,3.5,1,0,0,0.0,Frustrated,Moderate,High
I'm waiting for an goddamn restitution of dollars,Returns & Refunds,track_refund,Free,email,19.1,52.9,0,0,0,0.0,Frustrated,Moderate,High
help seeing what hours I can contact customer assistance,General Inquiries,contact_customer_service,Free,website,-10.7,82.7,0,0,0,0.0,Neutral,Minor,Low
can you help me to earn several products?,Orders & Shipping,place_order,Basic,freshdesk,-3.1,51.1,0,0,0,0.0,Neutral,Moderate,Medium
can I cancel my subscription to your corporate newsletter?,Subscription & Account Management,newsletter_subscription,Pro,zendesk,24.0,0.0,0,1,0,0.0,Neutral,Minor,Low
can uhelp me unsubscribe to the company newsletter,Subscription & Account Management,newsletter_subscription,Free,website,27.8,44.2,0,0,0,0.0,Neutral,Minor,Low
I have got to receive the corporate newsletter,Subscription & Account Management,newsletter_subscription,Enterprise,zendesk,0.7,7.3,2,0,0,0.0,Neutral,Minor,Medium
i have to speak with a bloody human agent,General Inquiries,contact_human_agent,Free,freshdesk,-27.9,99.9,0,0,0,0.0,Frustrated,Moderate,High
help seeing how soon can I expect my product,Orders & Shipping,delivery_period,Enterprise,zendesk,0.5,7.5,1,0,0,0.0,Frustrated,Moderate,High
see at what time I can get in touch with customer support,General Inquiries,contact_customer_service,Pro,freshdesk,-15.1,39.1,0,0,0,0.0,Neutral,Minor,Low
how can i find information about editing order,Orders & Shipping,change_order,Free,freshdesk,2.6,69.4,0,0,0,0.0,Neutral,Minor,Low
I don't kmow how I can make a claim,Complaints & Escalations,complaint,Enterprise,website,3.9,4.1,0,0,0,0.0,Neutral,Minor,Medium
i have to contact customer assistance how to do it,General Inquiries,contact_customer_service,Basic,website,48.0,0.0,0,0,0,0.0,Neutral,Minor,Low
can you help me give a quick look at bill #00108?,Billing & Payments,check_invoice,Basic,salesforce,33.6,14.4,0,0,0,0.0,Neutral,Minor,Low
wqnna notify of an error with payments,Billing & Payments,payment_issue,Basic,website,-3.8,51.8,0,0,0,0.0,Frustrated,Moderate,High
there are problems trying to update my shipping address,Orders & Shipping,change_shipping_address,Basic,website,15.8,32.2,0,0,0,0.0,Frustrated,Minor,Medium
need to receive the damn newsletter will uhelp me,Subscription & Account Management,newsletter_subscription,Pro,freshdesk,-9.2,33.2,0,0,0,0.0,Frustrated,Moderate,High
need assistance with opening a account,Account & Authentication,create_account,Basic,salesforce,-5.5,53.5,0,0,0,0.0,Neutral,Minor,Medium
can i check i which situations can i ask to be reimbursed,Returns & Refunds,check_refund_policy,Free,zendesk,35.5,36.5,0,0,0,0.0,Neutral,Minor,Medium
want assistance updating the address,Orders & Shipping,change_shipping_address,Free,email,72.0,0.0,0,0,0,0.0,Neutral,Minor,Low
"I have to subscribe to the newsletter, I need help",Subscription & Account Management,newsletter_subscription,Free,website,68.4,3.6,0,0,0,0.0,Neutral,Minor,Low
where to subscribe to the newsletter ?,Subscription & Account Management,newsletter_subscription,Pro,zendesk,11.0,13.0,2,0,0,0.0,Neutral,Minor,Low
can you help me check the status of my compensation?,Returns & Refunds,track_refund,Basic,website,39.8,8.2,0,0,0,0.0,Neutral,Minor,Medium
need help to see ur available payment methods,Billing & Payments,check_payment_methods,Enterprise,zendesk,4.4,3.6,0,0,0,0.0,Neutral,Minor,Medium
i dont know what i need to do to make a claim,Complaints & Escalations,complaint,Free,zendesk,11.0,61.0,1,0,0,0.0,Frustrated,Moderate,Medium
how do I check when my package is going to arrive?,Orders & Shipping,delivery_period,Basic,zendesk,-8.7,56.7,0,0,0,0.0,Neutral,Minor,Low
new bloody account for father,Account & Authentication,create_account,Free,website,24.7,47.3,0,0,0,0.0,Neutral,Minor,Medium
I do not know how to open a account for my daughter,Account & Authentication,create_account,Basic,salesforce,42.1,5.9,0,0,0,0.0,Neutral,Minor,Medium
I'd like to talk to an operatro,General Inquiries,contact_human_agent,Pro,email,12.2,11.8,1,0,0,0.0,Neutral,Minor,Medium
canya help me canceling my subscription to the newsletter,Subscription & Account Management,newsletter_subscription,Free,freshdesk,11.1,60.9,0,0,0,0.0,Neutral,Minor,Low
where can i leave my feedback about ur products,Customer Feedback,review,Basic,email,20.9,27.1,1,0,0,0.0,Neutral,Minor,Medium
I do not know what I have to do to make a customer lcaim,Complaints & Escalations,complaint,Pro,email,17.1,6.9,1,0,0,0.0,Frustrated,Moderate,Medium
I have to notify of issues with a signup,Account & Authentication,registration_problems,Pro,email,20.9,3.1,0,0,0,0.0,Frustrated,Moderate,High
I have errors setting up my new delivery address,Orders & Shipping,set_up_shipping_address,Free,email,52.1,19.9,0,0,0,0.0,Frustrated,Moderate,Medium
"I have to correct my personal data, how do I do it?",Account & Authentication,edit_account,Basic,website,32.2,15.8,0,0,0,0.0,Neutral,Minor,Low
assistance seeing the early termination charges,Returns & Refunds,check_cancellation_fee,Free,website,-1.4,73.4,0,0,0,0.0,Frustrated,Moderate,High
can you tell me more about correcting my delivery address?,Orders & Shipping,change_shipping_address,Free,website,32.0,40.0,1,0,0,0.0,Neutral,Minor,Low
I want help to make a customer complaint,Complaints & Escalations,complaint,Basic,zendesk,48.0,0.0,0,0,0,0.0,Frustrated,Moderate,Medium
i do not know how to leave a review about ur services,Customer Feedback,review,Free,website,5.3,66.7,0,0,0,0.0,Neutral,Minor,Low
I'm dissatisfied with ur services help to file a reclamation,Complaints & Escalations,complaint,Free,website,8.1,63.9,0,0,0,0.0,Frustrated,Moderate,High
see my restitution current status,Returns & Refunds,track_refund,Free,email,72.0,0.0,0,0,0,0.0,Neutral,Minor,Medium
where to inform of a sign-up problem?,Account & Authentication,registration_problems,Free,email,-3.8,75.8,0,0,0,0.0,Frustrated,Moderate,High
where to see the damn termination charges?,Returns & Refunds,check_cancellation_fee,Free,zendesk,56.1,15.9,1,0,0,0.0,Frustrated,Moderate,High
help to leave a comment for your services,Customer Feedback,review,Pro,website,22.2,1.8,0,0,0,0.0,Neutral,Minor,Low
"I have to send my feedback about your company, help me",Customer Feedback,review,Pro,email,24.0,0.0,1,0,0,0.0,Neutral,Minor,Low
"I can't pay, assistance reporting troubles with payment",Billing & Payments,payment_issue,Basic,zendesk,10.3,37.7,0,0,0,0.0,Frustrated,Moderate,High
assistance to request a reimbursement of my money,Returns & Refunds,get_refund,Basic,email,48.0,0.0,1,0,0,0.0,Neutral,Minor,Medium
i try to open a standard account,Account & Authentication,create_account,Basic,website,48.0,0.0,0,0,0,0.0,Neutral,Minor,Low
what do I need todo to speak with somebody?,General Inquiries,contact_human_agent,Enterprise,freshdesk,2.4,5.6,0,0,0,0.0,Neutral,Minor,Medium
I don't know how to call bloody customer support,General Inquiries,contact_customer_service,Basic,website,18.0,30.0,0,0,0,0.0,Frustrated,Minor,Medium
need help seeing at what time I can call customer assistance,General Inquiries,contact_customer_service,Pro,email,11.7,12.3,0,0,0,0.0,Neutral,Minor,Medium
i want assistance deleting the account,Account & Authentication,delete_account,Pro,zendesk,-15.4,39.4,0,0,0,0.0,Frustrated,Moderate,High
i want help reporting an issue with online payments,Billing & Payments,payment_issue,Free,email,14.6,57.4,0,0,0,0.0,Frustrated,Moderate,High
where can I report problems with payments?,Billing & Payments,payment_issue,Basic,website,13.8,34.2,0,0,0,0.0,Neutral,Minor,Medium
how do I order an article?,Orders & Shipping,place_order,Basic,email,-26.6,74.6,0,0,0,0.0,Neutral,Minor,Low
"I have to order some of your article, how can I do it?",Orders & Shipping,place_order,Basic,zendesk,18.8,29.2,0,0,0,0.0,Neutral,Minor,Medium
I don't know what I have to do to remove a account,Account & Authentication,delete_account,Free,salesforce,-51.2,123.2,0,0,0,0.0,Frustrated,Moderate,High
"I need to earn some articles, how can I do it?",Orders & Shipping,place_order,Basic,salesforce,-33.2,81.2,0,0,0,0.0,Neutral,Minor,Medium
lodging claim,Complaints & Escalations,complaint,Pro,website,-0.9,24.9,0,0,0,0.0,Frustrated,Moderate,High
i do not know what to do to modify the user info,Account & Authentication,edit_account,Free,email,6.1,65.9,0,0,0,0.0,Neutral,Minor,Medium
I cannot receive your corporate newsletter,Subscription & Account Management,newsletter_subscription,Basic,zendesk,48.0,0.0,1,0,0,0.0,Frustrated,Moderate,Medium
I have got to check in which cases can I ask for refunds,Returns & Refunds,check_refund_policy,Free,email,11.5,60.5,0,0,0,0.0,Neutral,Minor,Low
see invoices from,Billing & Payments,check_invoice,Free,zendesk,4.7,67.3,0,0,0,0.0,Neutral,Minor,Low
I don't know what to do to chat with an assistant,General Inquiries,contact_human_agent,Basic,salesforce,40.5,7.5,1,0,0,0.0,Neutral,Minor,Medium
I don'tknow what to do to check your payment options,Billing & Payments,check_payment_methods,Free,freshdesk,6.9,65.1,0,0,0,0.0,Neutral,Minor,Low
where to cancel the subscription to your newsletter?,Subscription & Account Management,newsletter_subscription,Enterprise,website,6.5,1.5,0,0,0,0.0,Neutral,Minor,Medium
how to submit the secondary delivery address?,Orders & Shipping,set_up_shipping_address,Free,website,-7.4,79.4,0,0,0,0.0,Neutral,Minor,Low
assistance lodging a reclamation against your organization,Complaints & Escalations,complaint,Free,email,-22.0,94.0,0,0,0,0.0,Frustrated,Moderate,High
wanna send some fedeback for ur services i need help,Customer Feedback,review,Basic,salesforce,12.1,35.9,0,0,0,0.0,Neutral,Minor,Low
"I need to subscribe to the company newsletter, how to do it?",Subscription & Account Management,newsletter_subscription,Pro,website,1.1,22.9,1,0,0,0.0,Neutral,Minor,Low
ohw to cancel order,Orders & Shipping,cancel_order,Free,zendesk,44.5,27.5,0,0,0,0.0,Neutral,Minor,Medium
help me to file a claim,Complaints & Escalations,complaint,Basic,zendesk,39.6,8.4,0,0,0,0.0,Frustrated,Moderate,Medium
i have to check how long refunds take how can i do it,Returns & Refunds,check_refund_policy,Basic,salesforce,1.3,46.7,0,0,0,0.0,Neutral,Minor,Low
i cannot check if there are any news on the compensation,Returns & Refunds,track_refund,Basic,email,24.1,23.9,0,0,0,0.0,Neutral,Minor,Medium
"I want to see what shipment options I have, how can I do it?",Orders & Shipping,delivery_options,Free,email,-11.6,83.6,0,0,0,0.0,Neutral,Minor,Low
assistance ordering a few ofur article,Orders & Shipping,place_order,Free,email,48.8,23.2,0,0,0,0.0,Neutral,Minor,Low
"I need to leave a review about a product, how to do it?",Customer Feedback,review,Free,zendesk,21.5,50.5,0,0,0,0.0,Neutral,Minor,Low
i have to speak to a eprson,General Inquiries,contact_human_agent,Free,freshdesk,72.0,0.0,0,0,0,0.0,Frustrated,Moderate,High
can I notify of an error with registrations?,Account & Authentication,registration_problems,Basic,website,48.0,0.0,0,0,0,0.0,Neutral,Moderate,Medium
want assistance to retrieve my profile pin,Account & Authentication,recover_password,Pro,freshdesk,4.3,19.7,0,0,0,0.0,Neutral,Minor,Medium
i need assistance to cancel my account,Account & Authentication,delete_account,Basic,website,43.1,4.9,0,1,0,0.0,Frustrated,Moderate,High
in what cases can I request reimbursements?,Returns & Refunds,check_refund_policy,Pro,website,-7.5,31.5,1,0,0,0.0,Neutral,Minor,Medium
where to check your payment modalities?,Billing & Payments,check_payment_methods,Free,freshdesk,48.7,23.3,0,0,0,0.0,Neutral,Minor,Low
subscribing to newsletter,Subscription & Account Management,newsletter_subscription,Free,website,-4.0,76.0,0,0,0,0.0,Neutral,Minor,Low
need to lodge a reclamation,Complaints & Escalations,complaint,Basic,email,48.0,0.0,0,0,0,0.0,Frustrated,Moderate,Medium
would you give me information about my account removal?,Account & Authentication,delete_account,Free,freshdesk,43.0,29.0,0,0,0,0.0,Neutral,Minor,Medium
can you help me chatting with a person?,General Inquiries,contact_human_agent,Basic,email,-13.2,61.2,0,0,0,0.0,Neutral,Minor,Medium
i have problems with opening a account,Account & Authentication,create_account,Free,freshdesk,3.8,68.2,0,0,0,0.0,Frustrated,Moderate,High
can uhelp me to sign up to the newsletter,Subscription & Account Management,newsletter_subscription,Basic,email,19.6,28.4,0,0,0,0.0,Neutral,Minor,Low
how do i create a pro account,Account & Authentication,create_account,Basic,email,48.0,0.0,1,0,0,0.0,Neutral,Minor,Medium
help me to see at what time I can contact customer support,General Inquiries,contact_customer_service,Free,website,-15.3,87.3,0,0,0,0.0,Neutral,Minor,Medium
need help filing a reclamation,Complaints & Escalations,complaint,Basic,email,8.8,39.2,1,0,0,0.0,Frustrated,Moderate,Medium
i need help to cancel a freemium account,Account & Authentication,delete_account,Basic,zendesk,15.6,32.4,0,0,0,0.0,Neutral,Minor,Low
help me to take a quick look at my bill from,Billing & Payments,check_invoice,Free,zendesk,-4.8,76.8,0,0,0,0.0,Frustrated,Moderate,High
wanna know about cancel the subscription to ur newsletter,Subscription & Account Management,newsletter_subscription,Enterprise,website,8.0,0.0,0,0,0,0.0,Neutral,Minor,Medium
wanna shop a few of ur article,Orders & Shipping,place_order,Free,zendesk,28.8,43.2,0,0,0,0.0,Neutral,Minor,Low
I want informatoin about the cancellation of my account,Account & Authentication,delete_account,Basic,zendesk,-13.8,61.8,0,0,0,0.0,Frustrated,Moderate,High
I want help leaving my feedback for your products,Customer Feedback,review,Basic,website,-9.6,57.6,0,0,0,0.0,Neutral,Minor,Low
can you help me opening a pro account?,Account & Authentication,create_account,Free,email,23.2,48.8,0,0,0,0.0,Neutral,Minor,Medium
I do not know what to do to chat with a live agent,General Inquiries,contact_human_agent,Pro,email,7.5,16.5,0,0,0,0.0,Neutral,Minor,Medium
help me checking what hours i can reach customer assistance,General Inquiries,contact_customer_service,Basic,email,-14.0,62.0,1,0,0,0.0,Frustrated,Moderate,High
where to make a consumer claim against your organization?,Complaints & Escalations,complaint,Free,email,-4.5,76.5,0,0,0,0.0,Frustrated,Moderate,High
i can no longer afford order could i cancel it,Orders & Shipping,cancel_order,Free,zendesk,8.3,63.7,0,0,0,0.0,Frustrated,Moderate,High
help me to check in which cases can I request reimbursements,Returns & Refunds,check_refund_policy,Pro,email,-2.0,26.0,1,0,0,0.0,Neutral,Minor,Medium
how do i check order current status,Orders & Shipping,track_order,Basic,salesforce,-0.4,48.4,0,0,0,0.0,Neutral,Minor,Low
I need help lodging an reclamation against your company,Complaints & Escalations,complaint,Pro,zendesk,22.5,1.5,1,0,0,0.0,Frustrated,Moderate,High
I want assistance to modify the shipping addresxs,Orders & Shipping,change_shipping_address,Basic,zendesk,15.5,32.5,0,0,0,0.0,Neutral,Minor,Medium
help me to restore the key of my user,Account & Authentication,recover_password,Free,salesforce,43.4,28.6,1,0,0,0.0,Neutral,Moderate,Medium
i dont know what i need to do to cancel a platinum account,Account & Authentication,delete_account,Pro,website,10.4,13.6,0,0,0,0.0,Frustrated,Moderate,High
information about canceling the newsletter subscription,Subscription & Account Management,newsletter_subscription,Enterprise,zendesk,-1.3,9.3,0,0,0,0.0,Neutral,Minor,Medium
i have got to see in which situations can i request a refund,Returns & Refunds,check_refund_policy,Basic,email,-17.3,65.3,1,0,0,0.0,Neutral,Minor,Medium
I need assistance to remove my standard account,Account & Authentication,delete_account,Pro,salesforce,22.6,1.4,1,0,0,0.0,Frustrated,Moderate,High
is it possible to see the cancellation fees?,Returns & Refunds,check_cancellation_fee,Free,website,61.8,10.2,0,0,0,0.0,Neutral,Minor,Medium
how can i speakto customer assistance,General Inquiries,contact_customer_service,Free,salesforce,29.8,42.2,0,0,0,0.0,Neutral,Minor,Low
I don't know how to unsubscribe from the goddamn newsletter,Subscription & Account Management,newsletter_subscription,Free,freshdesk,-8.1,80.1,1,0,0,0.0,Frustrated,Moderate,High
help to check the available payment methods,Billing & Payments,check_payment_methods,Pro,email,-3.5,27.5,1,0,0,0.0,Neutral,Minor,Medium
ya are not helpful could i speak with a fucking human agent,General Inquiries,contact_human_agent,Basic,email,25.4,22.6,0,0,0,0.0,Frustrated,Moderate,High
"I have to check the early exit charge, I need help",Returns & Refunds,check_cancellation_fee,Free,zendesk,38.7,33.3,0,0,0,0.0,Frustrated,Moderate,Medium
I do not know how I can subscribe to your company newsletter,Subscription & Account Management,newsletter_subscription,Basic,freshdesk,-15.7,63.7,2,0,0,0.0,Frustrated,Minor,Medium
what do I need to do to subscribe to the newsletter?,Subscription & Account Management,newsletter_subscription,Free,freshdesk,55.7,16.3,0,0,0,0.0,Neutral,Minor,Low
can I see what payment methods are available?,Billing & Payments,check_payment_methods,Pro,website,-1.3,25.3,3,0,0,0.0,Neutral,Minor,Low
i have to see how long refunds take how do i do it,Returns & Refunds,check_refund_policy,Free,email,47.3,24.7,1,0,0,0.0,Neutral,Minor,Medium
is there an e-mail to send an opinion about your products?,Customer Feedback,review,Free,zendesk,34.8,37.2,0,0,0,0.0,Neutral,Minor,Low
"I need to leave a review about a product, how to do it?",Customer Feedback,review,Basic,website,-49.2,97.2,0,0,0,0.0,Neutral,Minor,Low
need assistance speaking to a hujan agent,General Inquiries,contact_human_agent,Free,freshdesk,48.1,23.9,0,0,0,0.0,Neutral,Minor,Low
I need to talk with bloody customer support,General Inquiries,contact_customer_service,Free,zendesk,-29.6,101.6,0,0,0,0.0,Frustrated,Moderate,Medium
I want to cancel my subscription to the newsletter,Subscription & Account Management,newsletter_subscription,Free,freshdesk,36.0,36.0,0,1,0,0.0,Neutral,Minor,Low
want assistance checking the cancellation fees,Returns & Refunds,check_cancellation_fee,Free,email,48.8,23.2,0,0,0,0.0,Neutral,Minor,Low
I want help to see what bloody payment options are accepted,Billing & Payments,check_payment_methods,Basic,freshdesk,-2.3,50.3,0,0,0,0.0,Frustrated,Moderate,High
how to inform of an sign-up error,Account & Authentication,registration_problems,Free,email,72.0,0.0,0,0,0,0.0,Neutral,Moderate,Medium
need help checking whay hours I can reach customer support,General Inquiries,contact_customer_service,Free,email,-14.1,86.1,0,0,0,0.0,Frustrated,Minor,Medium
I have to subscribe to your newsletter,Subscription & Account Management,newsletter_subscription,Free,freshdesk,-13.2,85.2,0,0,0,0.0,Neutral,Minor,Low
help me cancel the subscription to ur newsletter,Subscription & Account Management,newsletter_subscription,Basic,freshdesk,48.0,0.0,0,0,0,0.0,Neutral,Minor,Low
switch to another user,Account & Authentication,switch_account,Pro,zendesk,11.6,12.4,1,0,0,0.0,Neutral,Minor,Medium
need help shopping a few of ur item,Orders & Shipping,place_order,Free,email,-4.1,76.1,0,0,0,0.0,Neutral,Minor,Low
I want a pro account,Account & Authentication,create_account,Free,freshdesk,36.3,35.7,0,0,0,0.0,Neutral,Moderate,Medium
see at what time i can call customer support,General Inquiries,contact_customer_service,Pro,zendesk,22.0,2.0,0,0,0,0.0,Neutral,Minor,Low
could i unsubscribe from the newsletter,Subscription & Account Management,newsletter_subscription,Free,email,4.5,67.5,0,0,0,0.0,Neutral,Minor,Low
want help to check what hours i cancall customer service,General Inquiries,contact_customer_service,Pro,freshdesk,15.2,8.8,1,0,0,0.0,Neutral,Minor,Low
what do i need to do to leave some feedback,Customer Feedback,review,Pro,salesforce,8.2,15.8,0,0,0,0.0,Positive,Minor,Low
how can i get information about my pass reset,Account & Authentication,recover_password,Pro,email,-6.8,30.8,0,0,0,0.0,Frustrated,Moderate,Medium
i have to list ur accepted payment options how to do it,Billing & Payments,check_payment_methods,Basic,website,-7.0,55.0,0,0,0,0.0,Neutral,Minor,Low
there is an error trying to update my address,Orders & Shipping,change_shipping_address,Basic,email,-1.1,49.1,0,0,0,0.0,Frustrated,Moderate,High
I don't know how to call bloody customer support,General Inquiries,contact_customer_service,Basic,website,10.7,37.3,1,0,0,0.0,Frustrated,Minor,Low
help me canceling the newsletter subscription,Subscription & Account Management,newsletter_subscription,Basic,freshdesk,5.8,42.2,0,0,0,0.0,Neutral,Minor,Low
can you help me leaving my feedback for a product?,Customer Feedback,review,Pro,email,3.8,20.2,0,0,0,0.0,Neutral,Minor,Low
I don't know how I could chat with a goddamn human agent,General Inquiries,contact_human_agent,Pro,salesforce,24.0,0.0,0,0,0,0.0,Frustrated,Moderate,Medium
can you help me leave a comment about a service?,Customer Feedback,review,Basic,freshdesk,1.5,46.5,0,0,0,0.0,Neutral,Minor,Low
in what cases can I ask to be reimbursed?,Returns & Refunds,check_refund_policy,Basic,email,40.2,7.8,0,0,0,0.0,Neutral,Minor,Medium
i cannot find the early termination fees,Returns & Refunds,check_cancellation_fee,Free,website,-6.1,78.1,1,0,0,0.0,Frustrated,Moderate,High
i do not knowhow i can list the payment options,Billing & Payments,check_payment_methods,Pro,website,-8.5,32.5,0,0,0,0.0,Neutral,Minor,Medium
information about canceling the newsletter subscription,Subscription & Account Management,newsletter_subscription,Basic,zendesk,48.0,0.0,0,0,0,0.0,Neutral,Minor,Low
tell me at what time customer service available is,General Inquiries,contact_customer_service,Basic,email,19.9,28.1,0,0,0,0.0,Neutral,Minor,Low
want assistance lodging a reclamation,Complaints & Escalations,complaint,Free,freshdesk,60.2,11.8,0,0,0,0.0,Frustrated,Moderate,Medium
I do not know what to do to talk to customer service,General Inquiries,contact_customer_service,Free,zendesk,40.8,31.2,0,0,0,0.0,Neutral,Minor,Medium
i want assistance checking what paytment methods ya accept,Billing & Payments,check_payment_methods,Free,email,43.7,28.3,0,0,0,0.0,Neutral,Minor,Low
help to check what hours I can call customer support,General Inquiries,contact_customer_service,Free,zendesk,35.0,37.0,1,0,0,0.0,Neutral,Minor,Low
I need to see how soon can I expect my purchase,Orders & Shipping,delivery_period,Pro,freshdesk,10.6,13.4,0,0,0,0.0,Neutral,Minor,Medium
"I want to see my reimbursement current status, help me",Returns & Refunds,track_refund,Basic,email,24.0,24.0,0,0,0,0.0,Neutral,Minor,Low
I try to check what hours I can call customer support,General Inquiries,contact_customer_service,Free,email,-18.2,90.2,0,0,0,0.0,Neutral,Minor,Low
help to acquire some products,Orders & Shipping,place_order,Pro,website,11.6,12.4,1,0,0,0.0,Neutral,Minor,Medium
i do not know what to do to contact an assistant,General Inquiries,contact_human_agent,Free,website,-4.1,76.1,0,0,0,0.0,Neutral,Minor,Low
help me check at what time i can contact cuswtomer support,General Inquiries,contact_customer_service,Pro,zendesk,-5.7,29.7,0,0,0,0.0,Neutral,Minor,Medium
help me checking what hours I can call customer support,General Inquiries,contact_customer_service,Free,freshdesk,35.2,36.8,0,0,0,0.0,Neutral,Minor,Low
I don't know how I could leave a comment about a service,Customer Feedback,review,Basic,salesforce,-12.7,60.7,0,0,0,0.0,Frustrated,Minor,Medium
